INSTALL EXTENSION vsql_statistics;
CREATE DATABASE IF NOT EXISTS vsql_test;
USE vsql_test;
CREATE TABLE skew_data (val DOUBLE);
INSERT INTO skew_data VALUES (1),(2),(3),(4),(5);
SELECT CAST(STATS_SKEWNESS(val) AS CHAR) AS skewness FROM skew_data;
skewness
{"moment":0,"pearson":0}
DELETE FROM skew_data;
INSERT INTO skew_data VALUES (2),(4),(4),(4),(5),(5),(7),(9);
SELECT CAST(STATS_SKEWNESS(val) AS CHAR) AS skewness FROM skew_data;
skewness
{"moment":0.65625,"pearson":0.75}
DELETE FROM skew_data;
INSERT INTO skew_data VALUES (2),(2),(2),(2),(2),(2),(2),(100);
SELECT JSON_VALUE(CAST(STATS_SKEWNESS(val) AS CHAR), '$.moment') + 0 > 0 AS moment_positive FROM skew_data;
moment_positive
1
DELETE FROM skew_data;
INSERT INTO skew_data VALUES (1),(100),(100),(100),(100),(100),(100),(100);
SELECT JSON_VALUE(CAST(STATS_SKEWNESS(val) AS CHAR), '$.moment') + 0 < 0 AS moment_negative FROM skew_data;
moment_negative
1
DELETE FROM skew_data;
INSERT INTO skew_data VALUES (NULL),(NULL),(NULL);
SELECT CAST(STATS_SKEWNESS(val) AS CHAR) AS skewness FROM skew_data;
skewness
NULL
DELETE FROM skew_data;
INSERT INTO skew_data VALUES (42);
SELECT CAST(STATS_SKEWNESS(val) AS CHAR) AS skewness FROM skew_data;
skewness
NULL
DELETE FROM skew_data;
INSERT INTO skew_data VALUES (1),(3);
SELECT CAST(STATS_SKEWNESS(val) AS CHAR) AS skewness FROM skew_data;
skewness
{"moment":0,"pearson":0}
DELETE FROM skew_data;
INSERT INTO skew_data VALUES (5),(5),(5),(5),(5);
SELECT CAST(STATS_SKEWNESS(val) AS CHAR) AS skewness FROM skew_data;
skewness
{"moment":null,"pearson":null}
DELETE FROM skew_data;
DROP TABLE skew_data;
CREATE TABLE vsql_test.skew_grouped (grp INT, val DOUBLE);
INSERT INTO skew_grouped VALUES
(1,1),(1,2),(1,3),(1,4),(1,5),
(2,2),(2,4),(2,4),(2,4),(2,5),(2,5),(2,7),(2,9);
SELECT grp,
CAST(STATS_SKEWNESS(val) AS CHAR) AS skewness
FROM vsql_test.skew_grouped
GROUP BY grp
ORDER BY grp;
grp	skewness
1	{"moment":0,"pearson":0}
2	{"moment":0.65625,"pearson":0.75}
DROP TABLE vsql_test.skew_grouped;
DROP DATABASE vsql_test;
UNINSTALL EXTENSION vsql_statistics;
