INSTALL EXTENSION vsql_statistics;
CREATE DATABASE IF NOT EXISTS vsql_test;
USE vsql_test;
CREATE TABLE ztest_data (val DOUBLE);
INSERT INTO ztest_data VALUES
(511.0775),(511.0775),(511.0775),(511.0775),(511.0775),
(511.0775),(511.0775),(511.0775),(511.0775),(511.0775),
(511.0775),(511.0775),(511.0775),(511.0775),(511.0775),
(511.0775),(511.0775),(511.0775),(511.0775),(511.0775),
(511.0775),(511.0775),(511.0775),(511.0775),(511.0775),
(511.0775),(511.0775),(511.0775),(511.0775),(511.0775),
(511.0775),(511.0775),(511.0775),(511.0775),(511.0775),
(511.0775),(511.0775),(511.0775),(511.0775),(511.0775);
SELECT ROUND(STATS_ZTEST_Z(val, 500.0, 40.0), 4)            AS z         FROM ztest_data;
z
1.7515
SELECT ROUND(STATS_ZTEST_P_TWO_TAIL(val, 500.0, 40.0), 4)   AS p_two     FROM ztest_data;
p_two
0.0799
SELECT ROUND(STATS_ZTEST_P_ONE_TAIL(val, 500.0, 40.0), 4)   AS p_one     FROM ztest_data;
p_one
0.0399
DELETE FROM ztest_data;
INSERT INTO ztest_data VALUES (4),(4),(4),(4);
SELECT STATS_ZTEST_Z(val, 3.0, 2.0)            AS z         FROM ztest_data;
z
1
SELECT STATS_ZTEST_P_TWO_TAIL(val, 3.0, 2.0)   AS p_two     FROM ztest_data;
p_two
0.3173105078629141
SELECT STATS_ZTEST_P_ONE_TAIL(val, 3.0, 2.0)   AS p_one     FROM ztest_data;
p_one
0.15865525393145705
DELETE FROM ztest_data;
INSERT INTO ztest_data VALUES (510.0);
SELECT ROUND(STATS_ZTEST_Z(val, 500.0, 40.0), 4) AS z FROM ztest_data;
z
0.25
DELETE FROM ztest_data;
INSERT INTO ztest_data VALUES (NULL),(NULL),(NULL);
SELECT STATS_ZTEST_Z(val, 500.0, 40.0)            AS z     FROM ztest_data;
z
NULL
SELECT STATS_ZTEST_P_ONE_TAIL(val, 500.0, 40.0)   AS p_one FROM ztest_data;
p_one
NULL
SELECT STATS_ZTEST_P_TWO_TAIL(val, 500.0, 40.0)   AS p_two FROM ztest_data;
p_two
NULL
DELETE FROM ztest_data;
INSERT INTO ztest_data VALUES (510.0),(520.0),(530.0);
SELECT STATS_ZTEST_Z(val, 500.0, 0.0)            AS z     FROM ztest_data;
z
NULL
SELECT STATS_ZTEST_P_ONE_TAIL(val, 500.0, 0.0)   AS p_one FROM ztest_data;
p_one
NULL
SELECT STATS_ZTEST_P_TWO_TAIL(val, 500.0, 0.0)   AS p_two FROM ztest_data;
p_two
NULL
DELETE FROM ztest_data;
INSERT INTO ztest_data VALUES (490.0),(490.0),(490.0),(490.0);
SELECT STATS_ZTEST_Z(val, 500.0, 2.0)          AS z         FROM ztest_data;
z
-10
SELECT STATS_ZTEST_P_TWO_TAIL(val, 500.0, 2.0) AS p_two     FROM ztest_data;
p_two
1.5239706048321186e-23
SELECT STATS_ZTEST_P_ONE_TAIL(val, 500.0, 2.0) > 0.5 AS p_one_gt_half FROM ztest_data;
p_one_gt_half
1
DELETE FROM ztest_data;
CREATE TABLE vsql_test.ztest_grouped (grp INT, val DOUBLE);
INSERT INTO ztest_grouped VALUES
(1,4),(1,4),(1,4),(1,4),
(2,3),(2,3),(2,3),(2,3),(2,3),(2,3),(2,3),(2,3),(2,3);
SELECT grp,
STATS_ZTEST_Z(val, 3.0, 2.0)            AS z,
STATS_ZTEST_P_TWO_TAIL(val, 3.0, 2.0)   AS p_two
FROM vsql_test.ztest_grouped
GROUP BY grp
ORDER BY grp;
grp	z	p_two
1	1	0.3173105078629141
2	0	1
DROP TABLE vsql_test.ztest_grouped;
DROP TABLE ztest_data;
DROP DATABASE vsql_test;
UNINSTALL EXTENSION vsql_statistics;
