INSTALL EXTENSION vsql_statistics;
CREATE DATABASE IF NOT EXISTS vsql_test;
USE vsql_test;
CREATE TABLE chisq_gof (observed DOUBLE, expected DOUBLE);
INSERT INTO chisq_gof VALUES (35,25),(20,25),(15,25),(30,25);
SELECT CAST(STATS_CHISQ_GOF(observed, expected) AS CHAR) AS gof FROM chisq_gof;
gof
{"chi_sq":10,"df":3,"p":0.0185661354630487}
DELETE FROM chisq_gof;
INSERT INTO chisq_gof VALUES (25,25),(25,25),(25,25),(25,25);
SELECT CAST(STATS_CHISQ_GOF(observed, expected) AS CHAR) AS gof FROM chisq_gof;
gof
{"chi_sq":0,"df":3,"p":1}
DELETE FROM chisq_gof;
INSERT INTO chisq_gof VALUES (40,50);
SELECT CAST(STATS_CHISQ_GOF(observed, expected) AS CHAR) AS gof FROM chisq_gof;
gof
{"chi_sq":2,"df":0,"p":null}
DELETE FROM chisq_gof;
INSERT INTO chisq_gof VALUES (NULL,NULL),(NULL,NULL);
SELECT CAST(STATS_CHISQ_GOF(observed, expected) AS CHAR) AS gof FROM chisq_gof;
gof
NULL
DELETE FROM chisq_gof;
INSERT INTO chisq_gof VALUES (35,25),(20,0),(15,25),(30,-5);
SELECT CAST(STATS_CHISQ_GOF(observed, expected) AS CHAR) AS gof FROM chisq_gof;
gof
{"chi_sq":8,"df":1,"p":0.00467773498104516}
DELETE FROM chisq_gof;
DROP TABLE chisq_gof;
CREATE TABLE chisq_indep (observed DOUBLE, expected DOUBLE);
INSERT INTO chisq_indep VALUES (60,40),(40,60),(20,40),(80,60);
SELECT CAST(STATS_CHISQ_INDEP(observed, expected, 2.0, 2.0) AS CHAR) AS indep FROM chisq_indep;
indep
{"chi_sq":33.3333333333333,"df":1,"p":0.000000007764037}
DELETE FROM chisq_indep;
INSERT INTO chisq_indep VALUES (NULL,NULL),(NULL,NULL);
SELECT CAST(STATS_CHISQ_INDEP(observed, expected, 2.0, 2.0) AS CHAR) AS indep FROM chisq_indep;
indep
NULL
DELETE FROM chisq_indep;
INSERT INTO chisq_indep VALUES (60,40),(40,60);
SELECT CAST(STATS_CHISQ_INDEP(observed, expected, 1.0, 2.0) AS CHAR) AS indep FROM chisq_indep;
indep
{"chi_sq":16.6666666666667,"df":0,"p":null}
DELETE FROM chisq_indep;
INSERT INTO chisq_indep VALUES (60,40),(40,60),(20,40),(80,60);
SELECT CAST(STATS_CHISQ_INDEP(observed, expected, 0.0, 0.0) AS CHAR) AS indep FROM chisq_indep;
indep
{"chi_sq":33.3333333333333,"df":null,"p":null}
DELETE FROM chisq_indep;
DROP TABLE chisq_indep;
CREATE TABLE vsql_test.chisq_grouped (grp INT, observed DOUBLE, expected DOUBLE);
INSERT INTO chisq_grouped VALUES
(1, 35, 25),(1, 20, 25),(1, 15, 25),(1, 30, 25),
(2, 25, 25),(2, 25, 25),(2, 25, 25),(2, 25, 25);
SELECT grp,
CAST(STATS_CHISQ_GOF(observed, expected) AS CHAR) AS gof
FROM vsql_test.chisq_grouped
GROUP BY grp
ORDER BY grp;
grp	gof
1	{"chi_sq":10,"df":3,"p":0.0185661354630487}
2	{"chi_sq":0,"df":3,"p":1}
DROP TABLE vsql_test.chisq_grouped;
DROP DATABASE vsql_test;
UNINSTALL EXTENSION vsql_statistics;
