INSTALL EXTENSION vsql_statistics;
CREATE DATABASE IF NOT EXISTS vsql_test;
USE vsql_test;
CREATE TABLE means_data (val DOUBLE, trim_pct DOUBLE);
INSERT INTO means_data VALUES (2,0.2),(10,0.2),(12,0.2),(14,0.2),(15,0.2),(18,0.2),(100,0.2);
SELECT STATS_MEAN_TRIMMED(val, trim_pct) AS trimmed FROM means_data;
trimmed
13.8
SELECT ROUND(STATS_MEAN_WINSORIZED(val, trim_pct), 2) AS winsorized FROM means_data;
winsorized
13.86
DELETE FROM means_data;
INSERT INTO means_data VALUES (2,0),(10,0),(12,0),(14,0),(15,0),(18,0),(100,0);
SELECT ROUND(STATS_MEAN_TRIMMED(val, trim_pct), 4)    AS trimmed_0  FROM means_data;
trimmed_0
24.4286
SELECT ROUND(STATS_MEAN_WINSORIZED(val, trim_pct), 4) AS winsorized_0 FROM means_data;
winsorized_0
24.4286
DELETE FROM means_data;
INSERT INTO means_data VALUES (NULL,0.2),(NULL,0.2);
SELECT STATS_MEAN_TRIMMED(val, trim_pct)    AS trimmed_null   FROM means_data;
trimmed_null
NULL
SELECT STATS_MEAN_WINSORIZED(val, trim_pct) AS winsorized_null FROM means_data;
winsorized_null
NULL
DELETE FROM means_data;
INSERT INTO means_data VALUES (10,0.5),(20,0.5);
SELECT STATS_MEAN_TRIMMED(val, trim_pct)    AS trimmed_degen   FROM means_data;
trimmed_degen
NULL
SELECT STATS_MEAN_WINSORIZED(val, trim_pct) AS winsorized_degen FROM means_data;
winsorized_degen
NULL
DROP TABLE means_data;
CREATE TABLE geo_data (val DOUBLE);
INSERT INTO geo_data VALUES (1.05),(1.10),(1.20);
SELECT ROUND(STATS_MEAN_GEOMETRIC(val), 4) AS geo_mean FROM geo_data;
geo_mean
1.1149
DELETE FROM geo_data;
INSERT INTO geo_data VALUES (-1),(0),(1.05),(1.10),(1.20);
SELECT ROUND(STATS_MEAN_GEOMETRIC(val), 4) AS geo_skip_nonpos FROM geo_data;
geo_skip_nonpos
1.1149
DELETE FROM geo_data;
INSERT INTO geo_data VALUES (NULL),(NULL);
SELECT STATS_MEAN_GEOMETRIC(val) AS geo_null FROM geo_data;
geo_null
NULL
DELETE FROM geo_data;
INSERT INTO geo_data VALUES (-5),(-3),(0);
SELECT STATS_MEAN_GEOMETRIC(val) AS geo_nonpos FROM geo_data;
geo_nonpos
NULL
DROP TABLE geo_data;
CREATE TABLE harm_data (val DOUBLE);
INSERT INTO harm_data VALUES (40),(60);
SELECT ROUND(STATS_MEAN_HARMONIC(val), 1) AS harm_mean FROM harm_data;
harm_mean
48
DELETE FROM harm_data;
INSERT INTO harm_data VALUES (-1),(0),(40),(60);
SELECT ROUND(STATS_MEAN_HARMONIC(val), 1) AS harm_skip_nonpos FROM harm_data;
harm_skip_nonpos
48
DELETE FROM harm_data;
INSERT INTO harm_data VALUES (NULL),(NULL);
SELECT STATS_MEAN_HARMONIC(val) AS harm_null FROM harm_data;
harm_null
NULL
DELETE FROM harm_data;
INSERT INTO harm_data VALUES (-5),(-3);
SELECT STATS_MEAN_HARMONIC(val) AS harm_nonpos FROM harm_data;
harm_nonpos
NULL
DROP TABLE harm_data;
CREATE TABLE vsql_test.means_grouped (grp INT, val DOUBLE, trim_pct DOUBLE);
INSERT INTO means_grouped VALUES
(1, 2,   0.2),(1, 10,  0.2),(1, 12,  0.2),(1, 14,  0.2),
(1, 15,  0.2),(1, 18,  0.2),(1, 100, 0.2),
(2, 1.05,0.0),(2, 1.10,0.0),(2, 1.20,0.0);
SELECT grp,
STATS_MEAN_TRIMMED(val, trim_pct)              AS trimmed,
ROUND(STATS_MEAN_GEOMETRIC(val), 4)            AS geo_mean,
ROUND(STATS_MEAN_HARMONIC(val), 4)             AS harm_mean
FROM vsql_test.means_grouped
GROUP BY grp
ORDER BY grp;
grp	trimmed	geo_mean	harm_mean
1	13.8	13.703	7.8919
2	1.116666666666667	1.1149	1.1133
DROP TABLE vsql_test.means_grouped;
DROP DATABASE vsql_test;
UNINSTALL EXTENSION vsql_statistics;
