INSTALL EXTENSION vsql_statistics;
CREATE DATABASE IF NOT EXISTS vsql_test;
USE vsql_test;
CREATE TABLE skew_data (val DOUBLE);
INSERT INTO skew_data VALUES (1),(2),(3),(4),(5);
SELECT STATS_SKEWNESS(val)         AS skewness        FROM skew_data;
skewness
0
SELECT STATS_SKEWNESS_PEARSON(val) AS skewness_pearson FROM skew_data;
skewness_pearson
0
DELETE FROM skew_data;
INSERT INTO skew_data VALUES (2),(4),(4),(4),(5),(5),(7),(9);
SELECT STATS_SKEWNESS(val)         AS skewness        FROM skew_data;
skewness
0.65625
SELECT STATS_SKEWNESS_PEARSON(val) AS skewness_pearson FROM skew_data;
skewness_pearson
0.75
DELETE FROM skew_data;
INSERT INTO skew_data VALUES (2),(2),(2),(2),(2),(2),(2),(100);
SELECT STATS_SKEWNESS(val) > 0 AS is_positive FROM skew_data;
is_positive
1
DELETE FROM skew_data;
INSERT INTO skew_data VALUES (1),(100),(100),(100),(100),(100),(100),(100);
SELECT STATS_SKEWNESS(val) < 0 AS is_negative FROM skew_data;
is_negative
1
DELETE FROM skew_data;
INSERT INTO skew_data VALUES (NULL),(NULL),(NULL);
SELECT STATS_SKEWNESS(val)         AS skewness        FROM skew_data;
skewness
NULL
SELECT STATS_SKEWNESS_PEARSON(val) AS skewness_pearson FROM skew_data;
skewness_pearson
NULL
DELETE FROM skew_data;
INSERT INTO skew_data VALUES (42);
SELECT STATS_SKEWNESS(val)         AS skewness        FROM skew_data;
skewness
NULL
SELECT STATS_SKEWNESS_PEARSON(val) AS skewness_pearson FROM skew_data;
skewness_pearson
NULL
DELETE FROM skew_data;
INSERT INTO skew_data VALUES (5),(5),(5),(5),(5);
SELECT STATS_SKEWNESS(val)         AS skewness        FROM skew_data;
skewness
NULL
SELECT STATS_SKEWNESS_PEARSON(val) AS skewness_pearson FROM skew_data;
skewness_pearson
NULL
DELETE FROM skew_data;
DROP TABLE skew_data;
CREATE TABLE vsql_test.skew_grouped (grp INT, val DOUBLE);
INSERT INTO skew_grouped VALUES
(1,1),(1,2),(1,3),(1,4),(1,5),
(2,2),(2,4),(2,4),(2,4),(2,5),(2,5),(2,7),(2,9);
SELECT grp,
STATS_SKEWNESS(val)         AS skewness,
STATS_SKEWNESS_PEARSON(val) AS skewness_pearson
FROM vsql_test.skew_grouped
GROUP BY grp
ORDER BY grp;
grp	skewness	skewness_pearson
1	0	0
2	0.65625	0.75
DROP TABLE vsql_test.skew_grouped;
DROP DATABASE vsql_test;
UNINSTALL EXTENSION vsql_statistics;
